QEMU 10.0.3 monitor - type 'help' for more information
(qemu) qemu-system-x86_64: vfio: Cannot reset device 0000:00:1f.4, no available reset mechanism.
qemu-system-x86_64: vfio: Cannot reset device 0000:00:1f.3, no available reset mechanism.
qemu-system-x86_64: vfio: Cannot reset device 0000:00:1f.5, no available reset mechanism.
qemu-system-x86_64: vfio: Cannot reset device 0000:00:1f.0, no available reset mechanism.
qemu-system-x86_64: vfio: Cannot reset device 0000:00:1f.4, no available reset mechanism.
qemu-system-x86_64: vfio: Cannot reset device 0000:00:1f.3, no available reset mechanism.
qemu-system-x86_64: vfio: Cannot reset device 0000:00:1f.5, no available reset mechanism.
qemu-system-x86_64: vfio: Cannot reset device 0000:00:1f.0, no available reset mechanism.
vfio_region_write  (0000:00:1f.3:region0+0x8, 0x0, 4)
vfio_region_write  (0000:00:1f.3:region0+0x8, 0x1, 4)
vfio_region_write  (0000:00:1f.3:region0+0xc, 0x0, 2)
vfio_region_write  (0000:00:1f.3:region0+0xe, 0x1, 2)
vfio_region_write  (0000:00:1f.3:region0+0x50, 0x58fe800, 4)
vfio_region_write  (0000:00:1f.3:region0+0x54, 0x1, 4)
vfio_region_write  (0000:00:1f.3:region0+0x40, 0x58fe000, 4)
vfio_region_write  (0000:00:1f.3:region0+0x44, 0x1, 4)
vfio_region_write  (0000:00:1f.3:region0+0x48, 0x0, 2)
vfio_region_write  (0000:00:1f.3:region0+0x4a, 0x8000, 2)
vfio_region_write  (0000:00:1f.3:region0+0x4a, 0x0, 2)
vfio_region_write  (0000:00:1f.3:region0+0x58, 0x8000, 2)
vfio_region_write  (0000:00:1f.3:region0+0x5a, 0x1, 2)
vfio_region_write  (0000:00:1f.3:region0+0xc48, 0x0, 4)
vfio_region_write  (0000:00:1f.3:region0+0xc88, 0x0, 4)
vfio_region_write  (0000:00:1f.3:region0+0x1d10, 0x3fd, 4)
vfio_region_write  (0000:00:1f.3:region0+0x38, 0x7ffff, 4)
vfio_region_write  (0000:00:1f.3:region0+0x20, 0x0, 4)
vfio_region_write  (0000:00:1f.3:region0+0x38, 0x0, 4)
vfio_region_write  (0000:00:1f.3:region0+0x1d10, 0x3ff, 4)
vfio_region_write  (0000:00:1f.3:region0+0x804, 0x40003803, 4)
vfio_region_write  (0000:00:1f.3:region0+0x804, 0xc0003803, 4)
vfio_region_write  (0000:00:1f.3:region0+0x20, 0x80000000, 4)
vfio_region_write  (0000:00:1f.3:region0+0x20, 0xc0000000, 4)
vfio_region_write  (0000:00:1f.3:region0+0xe, 0x3, 2)
vfio_region_write  (0000:00:1f.3:region0+0xc44, 0x800002, 4)
vfio_region_write  (0000:00:1f.3:region0+0xe, 0x4, 2)
vfio_region_write  (0000:00:1f.3:region0+0xc84, 0x800004, 4)
vfio_region_write  (0000:00:1f.3:region0+0x4c, 0x0, 1)
vfio_region_write  (0000:00:1f.3:region0+0x5c, 0x0, 1)
vfio_region_write  (0000:00:1f.3:region0+0x5c, 0x0, 1)
vfio_region_write  (0000:00:1f.3:region0+0x8, 0x1, 4)
